{
  "schema_version" : 1,
  "case_id" : "fb32351a-20f3-423d-8225-a44045a24725",
  "product_purl" : "pkg:generic/quarkus-run.jar@1.0.0",
  "git_commit" : "2d40fe00e036568bc746570d744e9ddf41014f9c",
  "sbom_sha256" : "86a2d1cda68b16fa3ef789cc06b091cadeb88c6511a84c3fa42980b5a2807796",
  "test_only" : true,
  "assessments" : [ {
    "vulnerability_id" : "TEST_ONLY-COMMONS-TEXT",
    "component_purl" : "pkg:maven/org.apache.commons/commons-text@1.9?type=jar",
    "component_ref" : "pkg:maven/org.apache.commons/commons-text@1.9?type=jar",
    "source_module" : "pkg:maven/com.themainthread/sample-app@1.0.0",
    "proposed_status" : "under_investigation",
    "justification" : null,
    "impact_statement" : null,
    "action_statement" : null,
    "reasoning" : "TEST_ONLY fixture: package presence does not establish exploitability or non-reachability.",
    "unknowns" : [ "Runtime reachability and attacker-controlled input" ],
    "recommended_next_step" : "Inspect call sites, configuration and runtime wiring with a human reviewer.",
    "evidence" : [ {
      "type" : "sbom",
      "path" : "input/distribution-sbom.json",
      "sha256" : "86a2d1cda68b16fa3ef789cc06b091cadeb88c6511a84c3fa42980b5a2807796",
      "locator" : "bom-ref:pkg:maven/org.apache.commons/commons-text@1.9?type=jar",
      "claim" : "TEST_ONLY exact inventory entry"
    }, {
      "type" : "advisory",
      "path" : "evidence/advisory-TEST_ONLY-COMMONS-TEXT.json",
      "sha256" : "54cab4942a8834a619bfe05474a71ef0db152cea1e6705ee2a338599f8ebbce7",
      "locator" : "document",
      "claim" : "TEST_ONLY advisory matches this package version"
    } ]
  } ]
}
